{
  "schema_version": 1,
  "descrizione": "Registro della PROVENIENZA: da quale fonte grezza nasce ogni pagina curata. Senza questo, raw/ e wiki/ restano due isole scollegate nel grafo (verificato: 0 archi tra i due strati prima dell'introduzione di questo registro) e la catena fonte -> conoscenza esiste solo nella documentazione. Applicato al grafo da tools/apply_provenance.py.",
  "convenzione": {
    "ancoraggi_area": "l'indice di un'area curata dichiara i documenti grezzi da cui l'area nasce: cuce i due strati in un unico componente connesso",
    "mappe_dirette": "quale nota grezza sta dietro a quale singola pagina (precisione fine)",
    "nota": "i file dichiarati ma non presenti nel grafo vengono segnalati, non fanno fallire la pipeline. graphify indicizza solo .md: le note .txt/.docx non sono nodi (limite noto, vedi ROADMAP)"
  },
  "ancoraggi_area": [
    {
      "indice": "wiki/aion/index.md",
      "fonti": [
        "raw/aion/aion-framework.md",
        "raw/aion/aion-agents.md",
        "raw/aion/aion-components.md",
        "raw/aion/aion-description.md",
        "raw/aion/aion-manifest.md",
        "raw/aion/aion-oracle.md"
      ],
      "nota": "wiki/aion e GENERATA da engine/aion.model.json (fonte unica), che a sua volta distilla questi sei documenti grezzi originali"
    },
    {
      "indice": "wiki/data-science/index.md",
      "fonti": [
        "raw/data-science/README.md"
      ],
      "nota": "l'area data-science e scritta a mano: il README grezzo indicizza le note di metodo da cui deriva"
    },
    {
      "indice": "wiki/creativita/index.md",
      "fonti": [
        "raw/creativita/bookforge/scrittura.md",
        "raw/creativita/bookforge/styledna.md",
        "raw/creativita/bookforge/anti-ai.md",
        "raw/creativita/bookforge/carta.md",
        "raw/creativita/bookforge/fasi.md"
      ],
      "nota": "l'area creativita distilla il sistema BookForge: la wiki tiene il METODO trasferibile, i file grezzi restano la fonte canonica"
    }
  ],
  "mappe_dirette": [
    {
      "wiki": "raw/divulgazione/metodo-report-verificati.md",
      "fonti": [
        "reports/template_showcase_3d.md"
      ],
      "nota": "F7: la conoscenza di metodo estratta dai report pubblicati (tools/report_harvest.py). Chiude il silo misurato: prima reports/ non aveva ALCUN arco verso gli strati di conoscenza — produceva lavoro che non tornava mai indietro. Il campo 'wiki' qui ospita una nota grezza: la derivazione e cio che conta, non la cartella."
    },
    {
      "wiki": "wiki/aion/aion-oracle.md",
      "fonti": [
        "raw/aion/aion-oracle.md"
      ],
      "nota": "la pagina curata dell'oracolo e il documento grezzo con la sequenza di Re Wen da cui nasce engine/iching.db.json"
    },
    {
      "wiki": "wiki/data-science/quartili-outlier.md",
      "fonti": [
        "raw/data-science/CALCOLO QUARTILE E INDIVIDUAZIONE OUTLIER.md"
      ]
    },
    {
      "wiki": "wiki/data-science/data-driven-culture.md",
      "fonti": [
        "raw/data-science/Data culture.md"
      ]
    },
    {
      "wiki": "wiki/data-science/intelligenza-artificiale.md",
      "fonti": [
        "raw/data-science/AI introduzione.md",
        "raw/data-science/Quarta rivoluzione indusriale.md"
      ]
    },
    {
      "wiki": "wiki/data-science/normalizzazione-decimali.md",
      "fonti": [
        "raw/data-science/normalizzare numeri decimali con errori.md"
      ]
    },
    {
      "wiki": "wiki/data-science/prompt-engineering.md",
      "fonti": [
        "raw/data-science/prompt engineering/prompt engineering base.md"
      ]
    },
    {
      "wiki": "wiki/data-science/data-storytelling.md",
      "fonti": [
        "raw/data-science/storytelling.md"
      ]
    },
    {
      "wiki": "wiki/data-science/mongodb.md",
      "fonti": [
        "raw/data-science/MongoDB/installazione.md",
        "raw/data-science/MongoDB/utilizzo tramite CMD.md",
        "raw/data-science/MongoDB/integrazione con python.md",
        "raw/data-science/MongoDB/beanie e python per MongoDB.md"
      ]
    },
    {
      "wiki": "wiki/data-science/sql.md",
      "fonti": [
        "raw/data-science/Sql/sql appunti.md"
      ]
    },
    {
      "wiki": "wiki/data-science/algebra-relazionale.md",
      "fonti": [
        "raw/data-science/Sql/Teoria algebra relazionale.md"
      ]
    },
    {
      "wiki": "wiki/data-science/progettazione-database.md",
      "fonti": [
        "raw/data-science/Sql/Progettazione DB.md"
      ]
    },
    {
      "wiki": "wiki/data-science/progetto-social-media.md",
      "fonti": [
        "raw/data-science/PROJECT WORK/Analisi Dati Social Media/Documentazione.md"
      ]
    },
    {
      "wiki": "wiki/data-science/progetto-hotel-booking.md",
      "fonti": [
        "raw/data-science/PROJECT WORK/Analisi prenotazioni hotel/DOCUMENTAZIONE.md"
      ]
    },
    {
      "wiki": "wiki/data-science/progetto-olist-ecommerce.md",
      "fonti": [
        "raw/data-science/PROJECT WORK/Brazilian E-Commerce Olist/LINEE GUIDA.md"
      ]
    },
    {
      "wiki": "wiki/data-science/progetto-insurance.md",
      "fonti": [
        "raw/data-science/PROJECT WORK/Insurance Analysis/1 data processing.md",
        "raw/data-science/PROJECT WORK/Insurance Analysis/2 analisi preliminare.md"
      ]
    },
    {
      "wiki": "wiki/data-science/python-pandas.md",
      "fonti": [
        "raw/data-science/PROJECT WORK/Analisi prenotazioni hotel/python prototype/API PANDAS.md",
        "raw/data-science/PROJECT WORK/Analisi dati magazzino finale/README.md"
      ],
      "nota": "+ le ricette pandas verificate del project work magazzino (pulizia, np.select, quantili, crosstab): la pagina distilla DUE progetti."
    },
    {
      "wiki": "wiki/data-science/struttura-report-analisi.md",
      "fonti": [
        "raw/data-science/PROJECT WORK/Analisi prenotazioni hotel/report/linee guida.md",
        "raw/data-science/PROJECT WORK/Analisi prenotazioni hotel/report/APPUNTI PER REPORT.md"
      ]
    },
    {
      "wiki": "wiki/data-science/power-bi.md",
      "fonti": [
        "raw/data-science/microsoft data analytics.md"
      ]
    },
    {
      "wiki": "wiki/creativita/styledna.md",
      "fonti": [
        "raw/creativita/bookforge/styledna.md"
      ],
      "nota": "vettore stilistico a 12 assi, tetti di salute e protocollo di deroga"
    },
    {
      "wiki": "wiki/creativita/anti-ai.md",
      "fonti": [
        "raw/creativita/bookforge/anti-ai.md"
      ],
      "nota": "i due fallimenti opposti e i tic da LLM"
    },
    {
      "wiki": "wiki/creativita/carta-della-prosa.md",
      "fonti": [
        "raw/creativita/bookforge/carta.md",
        "raw/creativita/bookforge/scrittura.md"
      ],
      "nota": "l'unica dottrina attiva in stesura"
    },
    {
      "wiki": "wiki/creativita/stilometria.md",
      "fonti": [
        "raw/creativita/bookforge/stylometry.py"
      ],
      "nota": "la verifica eseguibile: motore importato da tools/style_check.py"
    },
    {
      "wiki": "wiki/creativita/fasi-editoriali.md",
      "fonti": [
        "raw/creativita/bookforge/fasi.md",
        "raw/creativita/bookforge/percorsi.md",
        "raw/creativita/bookforge/kdp.md"
      ],
      "nota": "le sei fasi del processo"
    },
    {
      "wiki": "wiki/creativita/granularita-scrittura.md",
      "fonti": [
        "raw/creativita/bookforge/scrittura.md"
      ],
      "nota": "le tre tacche capitolo/scena/beat"
    },
    {
      "wiki": "wiki/creativita/stato-narrativo.md",
      "fonti": [
        "raw/creativita/bookforge/scrittura.md",
        "raw/creativita/bookforge/stato-bsr.md",
        "raw/creativita/bookforge/continuita.md"
      ],
      "nota": "NST, Ledger PIP e lettura a freddo"
    },
    {
      "wiki": "wiki/creativita/psicologia-personaggio.md",
      "fonti": [
        "raw/creativita/bookforge/psicologia.md"
      ],
      "nota": "9 assi, Enneagramma, protocollo pre-scena"
    },
    {
      "wiki": "wiki/data-science/progetto-magazzino.md",
      "fonti": [
        "raw/data-science/PROJECT WORK/Analisi dati magazzino finale/README.md"
      ],
      "nota": "il caso: 990 prodotti, due notebook, dashboard. Numeri ricalcolati da dataset_finale.csv, non ripresi dalla prosa dei notebook."
    },
    {
      "wiki": "wiki/data-science/indicatori-magazzino.md",
      "fonti": [
        "raw/data-science/PROJECT WORK/Analisi dati magazzino finale/README.md"
      ],
      "nota": "le 13 colonne derivate del secondo notebook, rese sistema riutilizzabile"
    },
    {
      "wiki": "wiki/data-science/limiti-dichiarati.md",
      "fonti": [
        "raw/data-science/PROJECT WORK/Analisi dati magazzino finale/README.md"
      ],
      "nota": "metodo estratto dai limiti che il project work ha dichiarato invece di aggirare (lotto assente, prezzo ambiguo, posizioni non plausibili)"
    },
    {
      "wiki": "wiki/divulgazione/corpus-universalis.md",
      "fonti": [
        "raw/divulgazione/universalis-austerita.md",
        "raw/divulgazione/universalis-davos-2026.md",
        "raw/divulgazione/universalis-nuovo-ordine-mondiale.md"
      ],
      "nota": "la mappa del corpus: 18 articoli propri smistati per materia, non per categoria del sito"
    },
    {
      "wiki": "wiki/divulgazione/come-si-spiega.md",
      "fonti": [
        "raw/divulgazione/universalis-austerita.md",
        "raw/finanza/universalis-spread.md",
        "raw/finanza/universalis-charles-dow.md",
        "raw/divulgazione/universalis-a-star-dijkstra.md"
      ],
      "nota": "i quattro dispositivi di chiarezza, ciascuno verificabile sull'articolo da cui e' estratto"
    },
    {
      "wiki": "wiki/divulgazione/onesta-argomentativa.md",
      "fonti": [
        "raw/finanza/universalis-bolla-tech-ia.md",
        "raw/finanza/universalis-oltre-il-costo-ia.md",
        "raw/finanza/universalis-mercati.md",
        "raw/finanza/universalis-spread.md",
        "raw/finanza/universalis-agenzie-di-rating.md"